[
  {
    "id": "MEM-00001",
    "source": "support",
    "date": "2026-05-18",
    "rawText": "CSV export is taking too long.",
    "productArea": "Reporting",
    "feature": "CSV Export",
    "sentiment": "negative",
    "severity": "medium",
    "theme": "performance",
    "userSegment": "Pro",
    "problem": "Slow CSV exports"
  },
  {
    "id": "MEM-00002",
    "source": "app_review",
    "date": "2026-05-19",
    "rawText": "The CSV download is extremely slow.",
    "productArea": "Reporting",
    "feature": "CSV Export",
    "sentiment": "negative",
    "severity": "medium",
    "theme": "performance",
    "userSegment": "Business",
    "problem": "Slow CSV exports"
  },
  {
    "id": "MEM-00003",
    "source": "survey",
    "date": "2026-05-20",
    "rawText": "Exporting a report to CSV takes too much time.",
    "productArea": "Reporting",
    "feature": "CSV Export",
    "sentiment": "negative",
    "severity": "medium",
    "theme": "performance",
    "userSegment": "Free",
    "problem": "Slow CSV exports"
  },
  {
    "id": "MEM-00004",
    "source": "social",
    "date": "2026-05-21",
    "rawText": "CSV generation becomes slow with larger reports.",
    "productArea": "Reporting",
    "feature": "CSV Export",
    "sentiment": "negative",
    "severity": "medium",
    "theme": "performance",
    "userSegment": "Pro",
    "problem": "Slow CSV exports"
  },
  {
    "id": "MEM-00005",
    "source": "community",
    "date": "2026-05-22",
    "rawText": "I have to wait too long for CSV exports.",
    "productArea": "Reporting",
    "feature": "CSV Export",
    "sentiment": "negative",
    "severity": "medium",
    "theme": "performance",
    "userSegment": "Business",
    "problem": "Slow CSV exports"
  },
  {
    "id": "MEM-00006",
    "source": "interview",
    "date": "2026-05-23",
    "rawText": "CSV export performance is getting worse.",
    "productArea": "Reporting",
    "feature": "CSV Export",
    "sentiment": "negative",
    "severity": "medium",
    "theme": "performance",
    "userSegment": "Free",
    "problem": "Slow CSV exports"
  },
  {
    "id": "MEM-00007",
    "source": "sales",
    "date": "2026-05-24",
    "rawText": "Large CSV exports frequently take several minutes.",
    "productArea": "Reporting",
    "feature": "CSV Export",
    "sentiment": "negative",
    "severity": "medium",
    "theme": "performance",
    "userSegment": "Pro",
    "problem": "Slow CSV exports"
  },
  {
    "id": "MEM-00008",
    "source": "store_review",
    "date": "2026-05-25",
    "rawText": "The report export seems stuck before downloading.",
    "productArea": "Reporting",
    "feature": "CSV Export",
    "sentiment": "negative",
    "severity": "medium",
    "theme": "performance",
    "userSegment": "Business",
    "problem": "Slow CSV exports"
  },
  {
    "id": "MEM-00009",
    "source": "support",
    "date": "2026-05-26",
    "rawText": "CSV downloads are slower than before.",
    "productArea": "Reporting",
    "feature": "CSV Export",
    "sentiment": "negative",
    "severity": "medium",
    "theme": "performance",
    "userSegment": "Free",
    "problem": "Slow CSV exports"
  },
  {
    "id": "MEM-00010",
    "source": "app_review",
    "date": "2026-05-27",
    "rawText": "Exporting customer data to CSV is painfully slow.",
    "productArea": "Reporting",
    "feature": "CSV Export",
    "sentiment": "negative",
    "severity": "medium",
    "theme": "performance",
    "userSegment": "Pro",
    "problem": "Slow CSV exports"
  },
  {
    "id": "MEM-00011",
    "source": "survey",
    "date": "2026-05-28",
    "rawText": "CSV export delays are affecting our workflow.",
    "productArea": "Reporting",
    "feature": "CSV Export",
    "sentiment": "negative",
    "severity": "medium",
    "theme": "performance",
    "userSegment": "Business",
    "problem": "Slow CSV exports"
  },
  {
    "id": "MEM-00012",
    "source": "social",
    "date": "2026-05-29",
    "rawText": "Our team waits too long for CSV reports.",
    "productArea": "Reporting",
    "feature": "CSV Export",
    "sentiment": "negative",
    "severity": "medium",
    "theme": "performance",
    "userSegment": "Free",
    "problem": "Slow CSV exports"
  },
  {
    "id": "MEM-00013",
    "source": "community",
    "date": "2026-05-30",
    "rawText": "CSV export is slow when the report has many rows.",
    "productArea": "Reporting",
    "feature": "CSV Export",
    "sentiment": "negative",
    "severity": "medium",
    "theme": "performance",
    "userSegment": "Pro",
    "problem": "Slow CSV exports"
  },
  {
    "id": "MEM-00014",
    "source": "interview",
    "date": "2026-05-31",
    "rawText": "The download spinner stays for a long time during CSV export.",
    "productArea": "Reporting",
    "feature": "CSV Export",
    "sentiment": "negative",
    "severity": "medium",
    "theme": "performance",
    "userSegment": "Business",
    "problem": "Slow CSV exports"
  },
  {
    "id": "MEM-00015",
    "source": "sales",
    "date": "2026-05-18",
    "rawText": "CSV reports are taking too long to generate.",
    "productArea": "Reporting",
    "feature": "CSV Export",
    "sentiment": "negative",
    "severity": "medium",
    "theme": "performance",
    "userSegment": "Free",
    "problem": "Slow CSV exports"
  },
  {
    "id": "MEM-00016",
    "source": "store_review",
    "date": "2026-05-19",
    "rawText": "Exporting data to CSV is becoming unreliable and slow.",
    "productArea": "Reporting",
    "feature": "CSV Export",
    "sentiment": "negative",
    "severity": "medium",
    "theme": "performance",
    "userSegment": "Pro",
    "problem": "Slow CSV exports"
  },
  {
    "id": "MEM-00017",
    "source": "support",
    "date": "2026-05-20",
    "rawText": "CSV export performance needs improvement.",
    "productArea": "Reporting",
    "feature": "CSV Export",
    "sentiment": "negative",
    "severity": "medium",
    "theme": "performance",
    "userSegment": "Business",
    "problem": "Slow CSV exports"
  },
  {
    "id": "MEM-00018",
    "source": "app_review",
    "date": "2026-05-21",
    "rawText": "The CSV download is very slow for our account.",
    "productArea": "Reporting",
    "feature": "CSV Export",
    "sentiment": "negative",
    "severity": "medium",
    "theme": "performance",
    "userSegment": "Free",
    "problem": "Slow CSV exports"
  },
  {
    "id": "MEM-00019",
    "source": "survey",
    "date": "2026-05-22",
    "rawText": "Generating CSV reports takes too much time.",
    "productArea": "Reporting",
    "feature": "CSV Export",
    "sentiment": "negative",
    "severity": "high",
    "theme": "performance",
    "userSegment": "Pro",
    "problem": "Slow CSV exports"
  },
  {
    "id": "MEM-00020",
    "source": "social",
    "date": "2026-05-23",
    "rawText": "CSV export is causing delays for our team.",
    "productArea": "Reporting",
    "feature": "CSV Export",
    "sentiment": "negative",
    "severity": "high",
    "theme": "performance",
    "userSegment": "Business",
    "problem": "Slow CSV exports"
  },
  {
    "id": "MEM-00021",
    "source": "community",
    "date": "2026-05-24",
    "rawText": "Large CSV reports are especially slow.",
    "productArea": "Reporting",
    "feature": "CSV Export",
    "sentiment": "negative",
    "severity": "high",
    "theme": "performance",
    "userSegment": "Free",
    "problem": "Slow CSV exports"
  },
  {
    "id": "MEM-00022",
    "source": "interview",
    "date": "2026-05-25",
    "rawText": "The CSV export process feels much slower this week.",
    "productArea": "Reporting",
    "feature": "CSV Export",
    "sentiment": "negative",
    "severity": "high",
    "theme": "performance",
    "userSegment": "Pro",
    "problem": "Slow CSV exports"
  },
  {
    "id": "MEM-00023",
    "source": "sales",
    "date": "2026-05-26",
    "rawText": "CSV downloads take several minutes to complete.",
    "productArea": "Reporting",
    "feature": "CSV Export",
    "sentiment": "negative",
    "severity": "high",
    "theme": "performance",
    "userSegment": "Business",
    "problem": "Slow CSV exports"
  },
  {
    "id": "MEM-00024",
    "source": "store_review",
    "date": "2026-05-27",
    "rawText": "I experienced another slow CSV export today.",
    "productArea": "Reporting",
    "feature": "CSV Export",
    "sentiment": "negative",
    "severity": "high",
    "theme": "performance",
    "userSegment": "Free",
    "problem": "Slow CSV exports"
  },
  {
    "id": "MEM-00025",
    "source": "support",
    "date": "2026-05-28",
    "rawText": "Our business users are complaining about CSV speed.",
    "productArea": "Reporting",
    "feature": "CSV Export",
    "sentiment": "negative",
    "severity": "high",
    "theme": "performance",
    "userSegment": "Pro",
    "problem": "Slow CSV exports"
  },
  {
    "id": "MEM-00026",
    "source": "app_review",
    "date": "2026-05-29",
    "rawText": "CSV export is too slow for daily reporting.",
    "productArea": "Reporting",
    "feature": "CSV Export",
    "sentiment": "negative",
    "severity": "high",
    "theme": "performance",
    "userSegment": "Business",
    "problem": "Slow CSV exports"
  },
  {
    "id": "MEM-00027",
    "source": "survey",
    "date": "2026-05-30",
    "rawText": "The export takes too long before the file appears.",
    "productArea": "Reporting",
    "feature": "CSV Export",
    "sentiment": "negative",
    "severity": "high",
    "theme": "performance",
    "userSegment": "Free",
    "problem": "Slow CSV exports"
  },
  {
    "id": "MEM-00028",
    "source": "social",
    "date": "2026-05-31",
    "rawText": "CSV generation slows down when the dataset is large.",
    "productArea": "Reporting",
    "feature": "CSV Export",
    "sentiment": "negative",
    "severity": "high",
    "theme": "performance",
    "userSegment": "Pro",
    "problem": "Slow CSV exports"
  },
  {
    "id": "MEM-00029",
    "source": "community",
    "date": "2026-05-18",